{
  "schema_version": "book-artifact-v1",
  "artifact_type": "book_research_agenda",
  "project_title": "Fixture Research Book",
  "created_at": "2026-05-12",
  "source_basis": "Fixture example; no live source lookup or full-text verification performed.",
  "what_i_can_verify": [
    "The artifact follows the shared book artifact schema."
  ],
  "what_remains_uncertain": [
    "All substantive research claims require user-provided sources or lookup."
  ],
  "user_verification_needed": [
    "Replace fixture content with project-specific verified source basis."
  ],
  "central_research_question": "What problem does the book explain, and what evidence can support that explanation?",
  "subquestions": [
    "Which claims require source support?",
    "Which terms must be defined before drafting?"
  ],
  "provisional_thesis": "The book can make a bounded argument if its key claims are separated from its speculative extensions.",
  "contribution_claim": "The project contributes a clearer synthesis of an unsettled debate without claiming final resolution.",
  "scope_boundaries": {
    "in_scope": [
      "Core concepts",
      "Representative source clusters"
    ],
    "out_of_scope": [
      "Unverified examples",
      "Claims without source strategy"
    ]
  },
  "evidence_plan": [
    "Source materials for factual claims",
    "Peer-reviewed sources for research context"
  ],
  "risks_and_mitigation": [
    "Risk: broad scope. Mitigation: chapter-level evidence ledgers.",
    "Risk: premature thesis certainty. Mitigation: peer-review critique before drafting."
  ]
}
