{
  "schema_version": "book-artifact-v1",
  "artifact_type": "claim_evidence_ledger",
  "project_title": "Fixture Research Book",
  "created_at": "2026-05-12",
  "source_basis": "Fixture example; no live source lookup or full-text verification performed.",
  "what_i_can_verify": [
    "The artifact follows the shared book artifact schema."
  ],
  "what_remains_uncertain": [
    "Current support and evidence status require actual draft/source review."
  ],
  "user_verification_needed": [
    "Verify each claim against available sources before relying on the ledger."
  ],
  "claims": [
    {
      "claim": "The chapter makes a causal claim that currently exceeds the evidence provided.",
      "claim_type": "causal",
      "evidence_status": "needs_stronger_evidence",
      "current_support": "Narrative plausibility only.",
      "evidence_needed": "Source support that can sustain a causal claim.",
      "risk": "high",
      "safer_wording": "The chapter can present this as a possible pathway pending stronger evidence."
    }
  ],
  "high_risk_claims": [
    "Causal claims without source support"
  ],
  "source_priorities": [
    "Sources that test rival explanations"
  ]
}
