{
  "schema_version": "book-artifact-v1",
  "artifact_type": "literature_map",
  "project_title": "Fixture Research Book",
  "created_at": "2026-05-12",
  "source_basis": "Fixture example; no live source lookup or full-text verification performed.",
  "what_i_can_verify": [
    "The artifact follows the shared book artifact schema."
  ],
  "what_remains_uncertain": [
    "Field structure, consensus, and gaps require a representative source set."
  ],
  "user_verification_needed": [
    "Replace fixture clusters with verified literature mapping from actual sources."
  ],
  "field_overview": "The literature should be mapped by claims, methods, assumptions, and topic.",
  "fields_and_subfields": [
    "Primary field named by the user",
    "Adjacent field that offers rival explanations"
  ],
  "schools_of_thought": [
    "School A emphasizes structure.",
    "School B emphasizes interpretation."
  ],
  "major_debates": [
    "Whether the core problem is best explained by one cause or several interacting causes."
  ],
  "consensus_controversy_map": [
    "Consensus: the problem matters.",
    "Controversy: the mechanism remains disputed."
  ],
  "development_map": [
    "Early framing introduced the vocabulary.",
    "Recent work challenges the older assumptions."
  ],
  "gaps_in_literature": [
    "Few sources connect the debate to book-length argument structure."
  ],
  "thesis_implications": "The thesis should be framed as a synthesis with explicit limits.",
  "sources_still_needed": [
    "Recent review source",
    "Source that challenges the preferred explanation"
  ]
}
